{
  "schemaVersion": 2,
  "id": "dtcron",
  "name": "Global X Data Center & Digital Infrastructure ETF (Ondo Tokenized)",
  "symbol": "DTCRon",
  "underlyingId": "fund-dtcr",
  "instrumentType": "security-backed-token",
  "denominationCurrency": "USD",
  "legalStructure": "Issuer-specific tokenized security providing economic exposure to a referenced publicly traded security.",
  "underlyingRights": "Economic exposure only; rights are governed by the issuer's product terms rather than direct ownership of the referenced security.",
  "redemptionRights": "Direct minting and redemption are available only through issuer onboarding, subject to eligibility and product terms.",
  "organizationRoles": [
    {
      "organizationId": "ondo-global-markets",
      "roles": [
        "issuer"
      ]
    },
    {
      "organizationId": "ondo-finance",
      "roles": [
        "tokenization-provider"
      ]
    }
  ],
  "description": "Tokenized economic exposure to the Global X Data Center & Digital Infrastructure ETF instrument, issued by Ondo Global Markets (BVI) Limited.",
  "assetClass": "exchange-traded-fund",
  "issuerId": "ondo-global-markets",
  "tokenizationProviderIds": [
    "ondo-finance"
  ],
  "status": "active",
  "website": "https://app.ondo.finance/assets/dtcron",
  "marketDataLinks": [
    {
      "provider": "Ondo Finance",
      "type": "issuer",
      "url": "https://app.ondo.finance/assets/dtcron",
      "description": "Issuer product page and primary instrument information."
    },
    {
      "provider": "RWA.xyz",
      "type": "aggregator",
      "url": "https://app.rwa-xyz.com/stocks",
      "description": "Independent tokenized-stock market dashboard; search for DTCRon."
    },
    {
      "provider": "DefiLlama",
      "type": "price-api",
      "url": "https://coins.llama.fi/prices/current/ethereum:0x4D9216151Dad1AF871A6EeC623e2F04E7a2717b3",
      "description": "Current third-party price response for the ethereum deployment."
    },
    {
      "provider": "Etherscan",
      "type": "chain-explorer",
      "url": "https://etherscan.io/token/0x4D9216151Dad1AF871A6EeC623e2F04E7a2717b3",
      "description": "Onchain supply, holders, transfers, and contract activity on ethereum."
    },
    {
      "provider": "DefiLlama",
      "type": "price-api",
      "url": "https://coins.llama.fi/prices/current/bsc:0xEc4C1944682B8c7ba6c825e9A8B2B32Cb5EcacE5",
      "description": "Current third-party price response for the bnb-chain deployment."
    },
    {
      "provider": "BscScan",
      "type": "chain-explorer",
      "url": "https://bscscan.com/token/0xEc4C1944682B8c7ba6c825e9A8B2B32Cb5EcacE5",
      "description": "Onchain supply, holders, transfers, and contract activity on bnb-chain."
    },
    {
      "provider": "DefiLlama",
      "type": "price-api",
      "url": "https://coins.llama.fi/prices/current/solana:t29YBAB7g6xzgRJkzmc5NkQ7YRjE3NF8mhsLgppondo",
      "description": "Current third-party price response for the Solana deployment."
    },
    {
      "provider": "Solana Explorer",
      "type": "chain-explorer",
      "url": "https://explorer.solana.com/address/t29YBAB7g6xzgRJkzmc5NkQ7YRjE3NF8mhsLgppondo",
      "description": "Onchain supply, holders, transfers, and mint activity on Solana."
    }
  ],
  "verifiedBy": [
    "ondo-token-list",
    "ondo-product-page"
  ],
  "dataAvailability": {
    "securityType": "unknown",
    "shareClass": "unknown",
    "offeringType": "unknown",
    "regulatoryExemption": "unknown",
    "prospectusUrl": "unknown"
  }
}
