{
  "schemaVersion": 2,
  "id": "robinhood-amzn",
  "name": "Amazon • Robinhood Token",
  "symbol": "AMZN",
  "underlyingId": "equity-amzn",
  "instrumentType": "debt-security",
  "denominationCurrency": "USD",
  "legalStructure": "Tokenized debt security issued by Robinhood Assets (Jersey) Limited.",
  "securityType": "Tokenized debt security referencing a publicly traded equity or ETF",
  "underlyingRights": "Economic exposure only; holders do not receive legal or beneficial rights in the referenced underlying security.",
  "redemptionRights": "Direct subscription and redemption are limited to Authorized Participants after KYB onboarding.",
  "organizationRoles": [
    {
      "organizationId": "robinhood-assets-jersey",
      "roles": [
        "issuer",
        "tokenization-provider"
      ]
    }
  ],
  "description": "Tokenized debt security issued by Robinhood Assets (Jersey) Limited, providing economic exposure to Amazon without ownership rights in the underlying security.",
  "identifiers": [
    {
      "scheme": "isin",
      "value": "US0231351067"
    },
    {
      "scheme": "issuer-id",
      "value": "0x000000000000000000000000000000004f508d5e2a7042299694d85c2f362ad2"
    }
  ],
  "assetClass": "public-equity",
  "issuerId": "robinhood-assets-jersey",
  "status": "active",
  "website": "https://docs.robinhood.com/chain/stock-tokens/",
  "marketDataLinks": [
    {
      "provider": "Robinhood",
      "type": "issuer",
      "url": "https://api.robinhood.com/rhj/assets",
      "description": "Official asset metadata and deployment catalog; search for AMZN."
    },
    {
      "provider": "Robinhood Chain Blockscout",
      "type": "chain-explorer",
      "url": "https://robinhoodchain.blockscout.com/token/0x12f190a9F9d7D37a250758b26824B97CE941bF54",
      "description": "Onchain contract, supply, holders, and transfers on Robinhood Chain."
    }
  ],
  "verifiedBy": [
    "robinhood-assets-api",
    "robinhood-stock-token-docs"
  ],
  "dataAvailability": {
    "securityType": "known",
    "shareClass": "unknown",
    "offeringType": "unknown",
    "regulatoryExemption": "unknown",
    "prospectusUrl": "unknown"
  }
}
