{
  "schemaVersion": 2,
  "id": "inroon",
  "name": "iShares US Industry Rotation Active ETF (Ondo Tokenized)",
  "symbol": "INROon",
  "underlyingId": "fund-inro",
  "instrumentType": "security-backed-token",
  "denominationCurrency": "USD",
  "legalStructure": "Issuer-specific tokenized security providing economic exposure to a referenced publicly traded security.",
  "underlyingRights": "Economic exposure only; rights are governed by the issuer's product terms rather than direct ownership of the referenced security.",
  "redemptionRights": "Direct minting and redemption are available only through issuer onboarding, subject to eligibility and product terms.",
  "organizationRoles": [
    {
      "organizationId": "ondo-global-markets",
      "roles": [
        "issuer"
      ]
    },
    {
      "organizationId": "ondo-finance",
      "roles": [
        "tokenization-provider"
      ]
    }
  ],
  "description": "Tokenized economic exposure to the iShares US Industry Rotation Active ETF instrument, issued by Ondo Global Markets (BVI) Limited.",
  "assetClass": "exchange-traded-fund",
  "issuerId": "ondo-global-markets",
  "tokenizationProviderIds": [
    "ondo-finance"
  ],
  "status": "active",
  "website": "https://app.ondo.finance/assets/inroon",
  "marketDataLinks": [
    {
      "provider": "Ondo Finance",
      "type": "issuer",
      "url": "https://app.ondo.finance/assets/inroon",
      "description": "Issuer product page and primary instrument information."
    },
    {
      "provider": "RWA.xyz",
      "type": "aggregator",
      "url": "https://app.rwa-xyz.com/stocks",
      "description": "Independent tokenized-stock market dashboard; search for INROon."
    },
    {
      "provider": "DefiLlama",
      "type": "price-api",
      "url": "https://coins.llama.fi/prices/current/ethereum:0xcafC59d86FAD601ea321c44439fE9D5B8F02ef0F",
      "description": "Current third-party price response for the ethereum deployment."
    },
    {
      "provider": "Etherscan",
      "type": "chain-explorer",
      "url": "https://etherscan.io/token/0xcafC59d86FAD601ea321c44439fE9D5B8F02ef0F",
      "description": "Onchain supply, holders, transfers, and contract activity on ethereum."
    },
    {
      "provider": "DefiLlama",
      "type": "price-api",
      "url": "https://coins.llama.fi/prices/current/bsc:0x790cFb394B1f399a3543Ba1F835DdE114A387eeb",
      "description": "Current third-party price response for the bnb-chain deployment."
    },
    {
      "provider": "BscScan",
      "type": "chain-explorer",
      "url": "https://bscscan.com/token/0x790cFb394B1f399a3543Ba1F835DdE114A387eeb",
      "description": "Onchain supply, holders, transfers, and contract activity on bnb-chain."
    },
    {
      "provider": "DefiLlama",
      "type": "price-api",
      "url": "https://coins.llama.fi/prices/current/solana:g4kT9HEg7rN4e5ZaEGHmzpkdM8qMbsZSHJojKeCondo",
      "description": "Current third-party price response for the Solana deployment."
    },
    {
      "provider": "Solana Explorer",
      "type": "chain-explorer",
      "url": "https://explorer.solana.com/address/g4kT9HEg7rN4e5ZaEGHmzpkdM8qMbsZSHJojKeCondo",
      "description": "Onchain supply, holders, transfers, and mint activity on Solana."
    }
  ],
  "verifiedBy": [
    "ondo-token-list",
    "ondo-product-page"
  ],
  "dataAvailability": {
    "securityType": "unknown",
    "shareClass": "unknown",
    "offeringType": "unknown",
    "regulatoryExemption": "unknown",
    "prospectusUrl": "unknown"
  }
}
