{
  "schemaVersion": 2,
  "id": "crdoon",
  "name": "Credo Technology Group Holding (Ondo Tokenized)",
  "symbol": "CRDOon",
  "underlyingId": "equity-crdo",
  "instrumentType": "security-backed-token",
  "denominationCurrency": "USD",
  "legalStructure": "Issuer-specific tokenized security providing economic exposure to a referenced publicly traded security.",
  "underlyingRights": "Economic exposure only; rights are governed by the issuer's product terms rather than direct ownership of the referenced security.",
  "redemptionRights": "Direct minting and redemption are available only through issuer onboarding, subject to eligibility and product terms.",
  "organizationRoles": [
    {
      "organizationId": "ondo-global-markets",
      "roles": [
        "issuer"
      ]
    },
    {
      "organizationId": "ondo-finance",
      "roles": [
        "tokenization-provider"
      ]
    }
  ],
  "description": "Tokenized economic exposure to Credo Technology Group Holding, issued by Ondo Global Markets (BVI) Limited.",
  "assetClass": "public-equity",
  "issuerId": "ondo-global-markets",
  "tokenizationProviderIds": [
    "ondo-finance"
  ],
  "status": "active",
  "website": "https://app.ondo.finance/assets/crdoon",
  "marketDataLinks": [
    {
      "provider": "Ondo Finance",
      "type": "issuer",
      "url": "https://app.ondo.finance/assets/crdoon",
      "description": "Issuer product page and primary instrument information."
    },
    {
      "provider": "RWA.xyz",
      "type": "aggregator",
      "url": "https://app.rwa-xyz.com/stocks",
      "description": "Independent tokenized-stock market dashboard; search for CRDOon."
    },
    {
      "provider": "DefiLlama",
      "type": "price-api",
      "url": "https://coins.llama.fi/prices/current/ethereum:0xB348a4Bce7FaE890d2d37Ea104e59fb3881757c2",
      "description": "Current third-party price response for the ethereum deployment."
    },
    {
      "provider": "Etherscan",
      "type": "chain-explorer",
      "url": "https://etherscan.io/token/0xB348a4Bce7FaE890d2d37Ea104e59fb3881757c2",
      "description": "Onchain supply, holders, transfers, and contract activity on ethereum."
    },
    {
      "provider": "DefiLlama",
      "type": "price-api",
      "url": "https://coins.llama.fi/prices/current/bsc:0xf157481bEBd0C0686780fd0F61806C900A6137e8",
      "description": "Current third-party price response for the bnb-chain deployment."
    },
    {
      "provider": "BscScan",
      "type": "chain-explorer",
      "url": "https://bscscan.com/token/0xf157481bEBd0C0686780fd0F61806C900A6137e8",
      "description": "Onchain supply, holders, transfers, and contract activity on bnb-chain."
    },
    {
      "provider": "DefiLlama",
      "type": "price-api",
      "url": "https://coins.llama.fi/prices/current/solana:d4Rc6KvP3nQT8zC86Z31zM1DJCSfUD6y424cKnZondo",
      "description": "Current third-party price response for the Solana deployment."
    },
    {
      "provider": "Solana Explorer",
      "type": "chain-explorer",
      "url": "https://explorer.solana.com/address/d4Rc6KvP3nQT8zC86Z31zM1DJCSfUD6y424cKnZondo",
      "description": "Onchain supply, holders, transfers, and mint activity on Solana."
    }
  ],
  "verifiedBy": [
    "ondo-token-list",
    "ondo-product-page"
  ],
  "dataAvailability": {
    "securityType": "unknown",
    "shareClass": "unknown",
    "offeringType": "unknown",
    "regulatoryExemption": "unknown",
    "prospectusUrl": "unknown"
  }
}
