{
  "schemaVersion": 2,
  "id": "nemon",
  "name": "Newmont (Ondo Tokenized)",
  "symbol": "NEMon",
  "underlyingId": "equity-nem",
  "instrumentType": "security-backed-token",
  "denominationCurrency": "USD",
  "legalStructure": "Issuer-specific tokenized security providing economic exposure to a referenced publicly traded security.",
  "underlyingRights": "Economic exposure only; rights are governed by the issuer's product terms rather than direct ownership of the referenced security.",
  "redemptionRights": "Direct minting and redemption are available only through issuer onboarding, subject to eligibility and product terms.",
  "organizationRoles": [
    {
      "organizationId": "ondo-global-markets",
      "roles": [
        "issuer"
      ]
    },
    {
      "organizationId": "ondo-finance",
      "roles": [
        "tokenization-provider"
      ]
    }
  ],
  "description": "Tokenized economic exposure to Newmont, issued by Ondo Global Markets (BVI) Limited.",
  "assetClass": "public-equity",
  "issuerId": "ondo-global-markets",
  "tokenizationProviderIds": [
    "ondo-finance"
  ],
  "status": "active",
  "website": "https://app.ondo.finance/assets/nemon",
  "marketDataLinks": [
    {
      "provider": "Ondo Finance",
      "type": "issuer",
      "url": "https://app.ondo.finance/assets/nemon",
      "description": "Issuer product page and primary instrument information."
    },
    {
      "provider": "RWA.xyz",
      "type": "aggregator",
      "url": "https://app.rwa-xyz.com/stocks",
      "description": "Independent tokenized-stock market dashboard; search for NEMon."
    },
    {
      "provider": "DefiLlama",
      "type": "price-api",
      "url": "https://coins.llama.fi/prices/current/ethereum:0x0C802aCB21Cb2AadB2EB5E5090868E1361B26B69",
      "description": "Current third-party price response for the ethereum deployment."
    },
    {
      "provider": "Etherscan",
      "type": "chain-explorer",
      "url": "https://etherscan.io/token/0x0C802aCB21Cb2AadB2EB5E5090868E1361B26B69",
      "description": "Onchain supply, holders, transfers, and contract activity on ethereum."
    },
    {
      "provider": "DefiLlama",
      "type": "price-api",
      "url": "https://coins.llama.fi/prices/current/bsc:0x5E63232993789601CE362e0240a299C1DfCBfbEc",
      "description": "Current third-party price response for the bnb-chain deployment."
    },
    {
      "provider": "BscScan",
      "type": "chain-explorer",
      "url": "https://bscscan.com/token/0x5E63232993789601CE362e0240a299C1DfCBfbEc",
      "description": "Onchain supply, holders, transfers, and contract activity on bnb-chain."
    },
    {
      "provider": "DefiLlama",
      "type": "price-api",
      "url": "https://coins.llama.fi/prices/current/solana:Dig28Tf1ufhCBAsjTmFkXCgcNgMqDMYj5A2rDQmondo",
      "description": "Current third-party price response for the Solana deployment."
    },
    {
      "provider": "Solana Explorer",
      "type": "chain-explorer",
      "url": "https://explorer.solana.com/address/Dig28Tf1ufhCBAsjTmFkXCgcNgMqDMYj5A2rDQmondo",
      "description": "Onchain supply, holders, transfers, and mint activity on Solana."
    }
  ],
  "verifiedBy": [
    "ondo-token-list",
    "ondo-product-page"
  ],
  "dataAvailability": {
    "securityType": "unknown",
    "shareClass": "unknown",
    "offeringType": "unknown",
    "regulatoryExemption": "unknown",
    "prospectusUrl": "unknown"
  }
}
