{
  "schemaVersion": 2,
  "id": "albon",
  "name": "Albemarle (Ondo Tokenized)",
  "symbol": "ALBon",
  "underlyingId": "equity-alb",
  "instrumentType": "security-backed-token",
  "denominationCurrency": "USD",
  "legalStructure": "Issuer-specific tokenized security providing economic exposure to a referenced publicly traded security.",
  "underlyingRights": "Economic exposure only; rights are governed by the issuer's product terms rather than direct ownership of the referenced security.",
  "redemptionRights": "Direct minting and redemption are available only through issuer onboarding, subject to eligibility and product terms.",
  "organizationRoles": [
    {
      "organizationId": "ondo-global-markets",
      "roles": [
        "issuer"
      ]
    },
    {
      "organizationId": "ondo-finance",
      "roles": [
        "tokenization-provider"
      ]
    }
  ],
  "description": "Tokenized economic exposure to Albemarle, issued by Ondo Global Markets (BVI) Limited.",
  "assetClass": "public-equity",
  "issuerId": "ondo-global-markets",
  "tokenizationProviderIds": [
    "ondo-finance"
  ],
  "status": "active",
  "website": "https://app.ondo.finance/assets/albon",
  "marketDataLinks": [
    {
      "provider": "Ondo Finance",
      "type": "issuer",
      "url": "https://app.ondo.finance/assets/albon",
      "description": "Issuer product page and primary instrument information."
    },
    {
      "provider": "RWA.xyz",
      "type": "aggregator",
      "url": "https://app.rwa-xyz.com/stocks",
      "description": "Independent tokenized-stock market dashboard; search for ALBon."
    },
    {
      "provider": "DefiLlama",
      "type": "price-api",
      "url": "https://coins.llama.fi/prices/current/ethereum:0x1b468d5535Ed7C19Ce42f0073db7Fdf441028131",
      "description": "Current third-party price response for the ethereum deployment."
    },
    {
      "provider": "Etherscan",
      "type": "chain-explorer",
      "url": "https://etherscan.io/token/0x1b468d5535Ed7C19Ce42f0073db7Fdf441028131",
      "description": "Onchain supply, holders, transfers, and contract activity on ethereum."
    },
    {
      "provider": "DefiLlama",
      "type": "price-api",
      "url": "https://coins.llama.fi/prices/current/bsc:0x0B790ABd6594918DE1022233b7cc79baDB84d92a",
      "description": "Current third-party price response for the bnb-chain deployment."
    },
    {
      "provider": "BscScan",
      "type": "chain-explorer",
      "url": "https://bscscan.com/token/0x0B790ABd6594918DE1022233b7cc79baDB84d92a",
      "description": "Onchain supply, holders, transfers, and contract activity on bnb-chain."
    },
    {
      "provider": "DefiLlama",
      "type": "price-api",
      "url": "https://coins.llama.fi/prices/current/solana:B5KufqHkskgGYwMXtL8FSHgREAkMQvE3ykhH5Kmondo",
      "description": "Current third-party price response for the Solana deployment."
    },
    {
      "provider": "Solana Explorer",
      "type": "chain-explorer",
      "url": "https://explorer.solana.com/address/B5KufqHkskgGYwMXtL8FSHgREAkMQvE3ykhH5Kmondo",
      "description": "Onchain supply, holders, transfers, and mint activity on Solana."
    }
  ],
  "verifiedBy": [
    "ondo-token-list",
    "ondo-product-page"
  ],
  "dataAvailability": {
    "securityType": "unknown",
    "shareClass": "unknown",
    "offeringType": "unknown",
    "regulatoryExemption": "unknown",
    "prospectusUrl": "unknown"
  }
}
